{
  "schema_version": 1,
  "id": "mut-validator-isdate-l10",
  "stratum": "mutant:logic",
  "language": "javascript",
  "license": "MIT",
  "source": {
    "kind": "generated",
    "generator": "codentry-mutate/1:equality-flip",
    "seed": 8363297600688285175,
    "origin": {
      "url": "https://github.com/validatorjs/validator.js",
      "commit": "9ff342479591ca5a43cb30000195bcf55c1bbed9",
      "path": "src/lib/isDate.js"
    }
  },
  "files": [
    {
      "path": "src/lib/isDate.js",
      "status": "modified",
      "base": "base/src/lib/isDate.js",
      "head": "head/src/lib/isDate.js"
    }
  ],
  "ground_truth_status": "labeled",
  "ground_truth": [
    {
      "file": "src/lib/isDate.js",
      "start_line": 36,
      "end_line": 36,
      "kind": "logic",
      "provenance": "mutation",
      "verified_by": [
        {
          "method": "construction",
          "ref": "codentry-mutate/1:equality-flip"
        }
      ],
      "description": "equality-flip (!== -> ===) at line 36. Equivalence unchecked.",
      "equivalence": "unchecked"
    }
  ]
}
