{
  "schema_version": 1,
  "id": "mut-semver-coerce-l01",
  "stratum": "mutant:logic",
  "language": "javascript",
  "license": "ISC",
  "source": {
    "kind": "generated",
    "generator": "codentry-mutate/1:constant-change",
    "seed": 3234775211362984131,
    "origin": {
      "url": "https://github.com/npm/node-semver",
      "commit": "6e05b7637396ac66522cff8731f07cfe0ef49a29",
      "path": "functions/coerce.js"
    }
  },
  "files": [
    {
      "path": "functions/coerce.js",
      "status": "modified",
      "base": "base/functions/coerce.js",
      "head": "head/functions/coerce.js"
    }
  ],
  "ground_truth_status": "labeled",
  "ground_truth": [
    {
      "file": "functions/coerce.js",
      "start_line": 57,
      "end_line": 57,
      "kind": "logic",
      "provenance": "mutation",
      "verified_by": [
        {
          "method": "construction",
          "ref": "codentry-mutate/1:constant-change"
        }
      ],
      "description": "constant-change (5 -> 6) at line 57. Equivalence unchecked.",
      "equivalence": "unchecked"
    }
  ]
}
