{
  "schema_version": 1,
  "id": "mut-validator-isstrongpassword-l04",
  "stratum": "mutant:logic",
  "language": "javascript",
  "license": "MIT",
  "source": {
    "kind": "generated",
    "generator": "codentry-mutate/1:negate-condition",
    "seed": 875064447989936195,
    "origin": {
      "url": "https://github.com/validatorjs/validator.js",
      "commit": "9ff342479591ca5a43cb30000195bcf55c1bbed9",
      "path": "src/lib/isStrongPassword.js"
    }
  },
  "files": [
    {
      "path": "src/lib/isStrongPassword.js",
      "status": "modified",
      "base": "base/src/lib/isStrongPassword.js",
      "head": "head/src/lib/isStrongPassword.js"
    }
  ],
  "ground_truth_status": "labeled",
  "ground_truth": [
    {
      "file": "src/lib/isStrongPassword.js",
      "start_line": 57,
      "end_line": 57,
      "kind": "logic",
      "provenance": "mutation",
      "verified_by": [
        {
          "method": "construction",
          "ref": "codentry-mutate/1:negate-condition"
        }
      ],
      "description": "negate-condition (C -> !(C)) at line 57. Equivalence unchecked.",
      "equivalence": "unchecked"
    }
  ]
}
