{
  "schema_version": 1,
  "id": "mut-plimit-index-l09",
  "stratum": "mutant:logic",
  "language": "javascript",
  "license": "MIT",
  "source": {
    "kind": "generated",
    "generator": "codentry-mutate/1:remove-await",
    "seed": 6480058005095090806,
    "origin": {
      "url": "https://github.com/sindresorhus/p-limit",
      "commit": "a8a6fbec4e0e866d6d779b10889bb4f5567e70eb",
      "path": "index.js"
    }
  },
  "files": [
    {
      "path": "index.js",
      "status": "modified",
      "base": "base/index.js",
      "head": "head/index.js"
    }
  ],
  "ground_truth_status": "labeled",
  "ground_truth": [
    {
      "file": "index.js",
      "start_line": 43,
      "end_line": 43,
      "kind": "logic",
      "provenance": "mutation",
      "verified_by": [
        {
          "method": "construction",
          "ref": "codentry-mutate/1:remove-await"
        }
      ],
      "description": "remove-await (await removed) at line 43. Equivalence unchecked.",
      "equivalence": "unchecked"
    }
  ]
}
