{
  "schema_version": 1,
  "id": "bug-hexo-1",
  "stratum": "real:bugsjs",
  "language": "javascript",
  "license": "MIT",
  "source": {
    "kind": "repository",
    "url": "https://github.com/BugsJS/hexo",
    "base_sha": "58ed4bb49156f1818883cb88af364a13c591d343",
    "head_sha": "7589ac75871521e9d73133f943c69582dc7373b2",
    "derivation": "reversed_fix",
    "base_ref": "Bug-1-fix",
    "head_ref": "Bug-1"
  },
  "files": [
    {
      "path": "lib/plugins/console/generate.js",
      "status": "modified",
      "base": "base/lib/plugins/console/generate.js",
      "head": "head/lib/plugins/console/generate.js"
    }
  ],
  "ground_truth_status": "labeled",
  "ground_truth": [
    {
      "file": "lib/plugins/console/generate.js",
      "start_line": 16,
      "end_line": 16,
      "kind": "correctness",
      "provenance": "real_defect",
      "verified_by": [
        {
          "method": "dataset_annotation",
          "ref": "BugsJS Hexo-1: manually validated bug (Gyimesi et al., ICST 2019)"
        }
      ],
      "group": "bugsjs-hexo-1",
      "description": "Location 1 of 1 changed by the fix of BugsJS Hexo-1 (category: generic --> variable initialization --> missing variable initialization)."
    }
  ]
}
