{
  "schema_version": 1,
  "id": "pr-zod-6620",
  "stratum": "noise:pr",
  "language": "typescript",
  "license": "MIT",
  "source": {
    "kind": "repository",
    "url": "https://github.com/colinhacks/zod",
    "base_sha": "94886319faac483a0f5aaf262b5d025728120da1",
    "head_sha": "10dda3a3a4bc76ed0bf83e994de194587e489ef8",
    "derivation": "pull_request",
    "pull_request": 6620
  },
  "files": [
    {
      "path": "packages/zod/src/v4/core/versions.ts",
      "status": "modified",
      "base": "base/packages/zod/src/v4/core/versions.ts",
      "head": "head/packages/zod/src/v4/core/versions.ts"
    }
  ],
  "ground_truth_status": "unlabeled",
  "ground_truth": []
}
